{
  "version": "1.0.0",
  "contract_version": "SLGE-SDLC-R0.v1",
  "artifact_kinds": [
    {
      "artifact_kind_id": "ConstitutionalLaw",
      "display_name": "Constitutional Law Artifact",
      "description": "Law-level artifact that governs branch boundaries and obligations."
    },
    {
      "artifact_kind_id": "LifecycleContractRegistry",
      "display_name": "Lifecycle Contract Registry",
      "description": "Machine-readable lifecycle ontology and transition contract registry."
    },
    {
      "artifact_kind_id": "ProjectionRuntimeBoundary",
      "display_name": "Projection Runtime Boundary",
      "description": "Reducer runtime artifact that computes current state from authoritative records."
    }
  ],
  "maturity_dimensions": [
    {
      "dimension_id": "LifecycleSlot",
      "allowed_values": [
        "SLGE-SDLC-L0",
        "SLGE-SDLC-R0",
        "SLGE-SDLC-M0",
        "SLGE-SDLC-E0",
        "SLGE-SDLC-P0",
        "SLGE-SDLC-G0",
        "SLGE-SDLC-C0"
      ]
    },
    {
      "dimension_id": "EpistemicRank",
      "allowed_values": ["E0", "E1", "E2", "E3", "E4", "E5"]
    },
    {
      "dimension_id": "ConstitutionalMaturity",
      "allowed_values": ["PROPOSED", "RATIFIED", "SUPERSEDED"]
    },
    {
      "dimension_id": "RuntimeMaturity",
      "allowed_values": [
        "ABSENT",
        "CONTRACT_ONLY",
        "IMPLEMENTATION_CANDIDATE",
        "VERIFIED",
        "ADMITTED",
        "QUARANTINED"
      ]
    },
    {
      "dimension_id": "ReleaseMaturity",
      "allowed_values": ["EXPERIMENTAL", "ALPHA", "STABLE", "FROZEN"]
    },
    {
      "dimension_id": "GeneralityScope",
      "allowed_values": ["LOCAL", "DOMAIN", "MULTI_DOMAIN", "CROSS_DOMAIN_CANDIDATE", "GENERAL_CANDIDATE"]
    }
  ],
  "lifecycle_slots": [
    {
      "slot_id": "SLGE-SDLC-L0",
      "display_name": "Lifecycle Constitution",
      "accepted_artifact_kinds": ["ConstitutionalLaw"],
      "entry_boundary": "Law-only ratification boundary from docs/124.",
      "required_inputs": ["RatifiedLawEntry", "ChainTrace"],
      "allowed_operations": ["DeclareLifecycleOntology"],
      "forbidden_outputs": ["LifecycleRuntimeExecution", "TransitionApproval", "ClosureClaim"],
      "evidence_policy_refs": ["EVR-SLGE-L0-RATIFICATION", "EVR-SLGE-L0-EMPIRICAL"],
      "gate_ref": "GATE-SLGE-LIFECYCLE-TRANSITION",
      "authority_ceiling": "LawAuthority",
      "residual_policy": "Residuals remain visible and may be deferred to successor slots.",
      "trace_policy": "Trace must bind law, chain, and artifact identity references.",
      "closure_predicate_ref": "CP-LAW-ONLY-RATIFIED",
      "allowed_next_slot_refs": ["SLGE-SDLC-R0"]
    },
    {
      "slot_id": "SLGE-SDLC-R0",
      "display_name": "Lifecycle Registry and Machine Contracts",
      "accepted_artifact_kinds": ["LifecycleContractRegistry"],
      "entry_boundary": "Only direct successor after SLGE-SDLC-L0.",
      "required_inputs": ["RatifiedLifecycleLaw", "TypedRegistryContracts"],
      "allowed_operations": ["DefineMachineContracts", "ValidateContractTopology"],
      "forbidden_outputs": ["LifecycleRuntimeExecution", "TransitionAdmission", "ClosureClaim"],
      "evidence_policy_refs": ["EVR-SLGE-R0-GOVERNANCE"],
      "gate_ref": "GATE-SLGE-LIFECYCLE-TRANSITION",
      "authority_ceiling": "ProjectionContractAuthority",
      "residual_policy": "Execution and remap residuals are explicitly deferred to M0/E0/P0/G0/C0.",
      "trace_policy": "Trace must bind contracts to law origin and governance records.",
      "closure_predicate_ref": "CP-R0-MACHINE-CONTRACTS-CLOSED",
      "allowed_next_slot_refs": ["SLGE-SDLC-M0"]
    },
    {
      "slot_id": "SLGE-SDLC-M0",
      "display_name": "Legacy Lifecycle Remap",
      "accepted_artifact_kinds": ["LifecycleContractRegistry"],
      "entry_boundary": "Opens only after R0 contracts are complete.",
      "required_inputs": ["ContractTopology", "LegacyRegistry"],
      "allowed_operations": ["ClassifyLegacyRecords"],
      "forbidden_outputs": ["LifecycleRuntimeExecution", "HistoricalCertificateFabrication"],
      "evidence_policy_refs": [],
      "gate_ref": "GATE-SLGE-LIFECYCLE-TRANSITION",
      "authority_ceiling": "ProjectionContractAuthority",
      "residual_policy": "Legacy proof gaps remain visible.",
      "trace_policy": "Trace must preserve source-to-remap lineage.",
      "closure_predicate_ref": "CP-M0-REMAP-CLOSED",
      "allowed_next_slot_refs": ["SLGE-SDLC-E0"]
    },
    {
      "slot_id": "SLGE-SDLC-E0",
      "display_name": "Lifecycle Execution Engine",
      "accepted_artifact_kinds": ["LifecycleContractRegistry"],
      "entry_boundary": "May open only after remap readiness is complete in M0.",
      "required_inputs": ["RemapTopology", "TransitionContracts", "EvidenceRequirements"],
      "allowed_operations": ["ExecuteLifecycleTransitionChecks"],
      "forbidden_outputs": ["ClosureClaim", "StateProjectionClaimWithoutP0"],
      "evidence_policy_refs": [],
      "gate_ref": "GATE-SLGE-LIFECYCLE-TRANSITION",
      "authority_ceiling": "ProjectionRuntimeAuthority",
      "residual_policy": "Execution residuals must remain visible until resolved or deferred.",
      "trace_policy": "Trace must bind execution checks to evidence and residual deltas.",
      "closure_predicate_ref": "CP-E0-ENGINE-READY",
      "allowed_next_slot_refs": ["SLGE-SDLC-P0"]
    },
    {
      "slot_id": "SLGE-SDLC-P0",
      "display_name": "Lifecycle State Projection",
      "accepted_artifact_kinds": ["LifecycleContractRegistry"],
      "entry_boundary": "May open only after execution engine surface is available.",
      "required_inputs": ["LifecycleEvents", "ReductionContract", "ProjectionTrace"],
      "allowed_operations": ["ProjectLifecycleCurrentState"],
      "forbidden_outputs": ["PRRuntimeEnforcement", "ClosureClaim"],
      "evidence_policy_refs": [],
      "gate_ref": "GATE-SLGE-LIFECYCLE-TRANSITION",
      "authority_ceiling": "CurrentStateProjectionAuthority",
      "residual_policy": "Projection residuals stay visible until governance enforcement opens.",
      "trace_policy": "Trace must preserve event-to-state projection lineage.",
      "closure_predicate_ref": "CP-P0-PROJECTION-READY",
      "allowed_next_slot_refs": ["SLGE-SDLC-G0"]
    },
    {
      "slot_id": "SLGE-SDLC-G0",
      "display_name": "Repository and PR Enforcement",
      "accepted_artifact_kinds": ["LifecycleContractRegistry"],
      "entry_boundary": "May open only after lifecycle projection is available.",
      "required_inputs": ["LifecycleProjection", "EnforcementContracts"],
      "allowed_operations": ["EnforceLifecycleDeclarations"],
      "forbidden_outputs": ["ClosureClaim"],
      "evidence_policy_refs": [],
      "gate_ref": "GATE-SLGE-LIFECYCLE-TRANSITION",
      "authority_ceiling": "RuntimeAuthority",
      "residual_policy": "Enforcement residuals remain visible and bounded.",
      "trace_policy": "Trace binds declarations to enforcement outcomes.",
      "closure_predicate_ref": "CP-G0-ENFORCEMENT-READY",
      "allowed_next_slot_refs": ["SLGE-SDLC-C0"]
    },
    {
      "slot_id": "SLGE-SDLC-C0",
      "display_name": "Lifecycle Closure Audit",
      "accepted_artifact_kinds": ["LifecycleContractRegistry"],
      "entry_boundary": "May open only after governance enforcement is active.",
      "required_inputs": ["LifecycleProjection", "EnforcementHistory", "ResidualLedger"],
      "allowed_operations": ["EvaluateLifecycleClosureObligations"],
      "forbidden_outputs": ["V1ClosedClaim", "GeneralValidationClaim"],
      "evidence_policy_refs": [],
      "gate_ref": "GATE-SLGE-LIFECYCLE-TRANSITION",
      "authority_ceiling": "EvidenceAuthority",
      "residual_policy": "Closure residuals remain explicit as PROVEN/REFUSED/DEFERRED.",
      "trace_policy": "Trace must reconstruct closure verdict lineage.",
      "closure_predicate_ref": "CP-C0-CLOSURE-EVALUATED",
      "allowed_next_slot_refs": []
    }
  ],
  "project_artifacts": [
    {
      "artifact_id": "DOC-124",
      "artifact_kind": "ConstitutionalLaw",
      "semantic_identity_ref": "SID_SLGE_PDLC_CONSTITUTION",
      "origin_refs": ["SLGE-SDLC-L0", "Amendment-102"],
      "domain": "governance",
      "scope": "project_lifecycle_constitution",
      "current_lifecycle_slot_ref": "SLGE-SDLC-L0",
      "epistemic_rank_ref": "E1",
      "constitutional_maturity_ref": "RATIFIED",
      "runtime_maturity_ref": "ABSENT",
      "release_maturity_ref": "ALPHA",
      "generality_scope_ref": "LOCAL",
      "authority_roles": ["LawAuthority", "ProjectionContractAuthority"],
      "evidence_requirement_refs": ["EVR-SLGE-L0-RATIFICATION", "EVR-SLGE-L0-EMPIRICAL"],
      "residual_refs": ["SLGE-L0-EMPIRICAL-EVIDENCE-DEFERRED"],
      "trace_refs": [
        "docs/124_SLOT_LICENSED_GEOMETRICAL_ENGINEERING_PROJECT_DEVELOPMENT_LIFECYCLE_CONSTITUTION.md",
        "docs/14_PR_CHAIN_ROADMAP.md"
      ],
      "dependency_refs": ["DEP-OPENS-SLGE-SDLC-L0-TO-SLGE-SDLC-R0"]
    },
    {
      "artifact_id": "SLGE-SDLC-R0-CONTRACTS",
      "artifact_kind": "LifecycleContractRegistry",
      "semantic_identity_ref": "SID_SLGE_SDLC_R0_MACHINE_CONTRACTS",
      "origin_refs": ["SLGE-SDLC-R0"],
      "domain": "governance",
      "scope": "lifecycle_machine_contracts",
      "current_lifecycle_slot_ref": "SLGE-SDLC-R0",
      "epistemic_rank_ref": "E1",
      "constitutional_maturity_ref": "RATIFIED",
      "runtime_maturity_ref": "CONTRACT_ONLY",
      "release_maturity_ref": "ALPHA",
      "generality_scope_ref": "LOCAL",
      "authority_roles": ["ProjectionContractAuthority", "EvidenceAuthority"],
      "evidence_requirement_refs": ["EVR-SLGE-R0-GOVERNANCE"],
      "residual_refs": [
        "SLGE-M0-LEGACY-REMAP-PENDING",
        "SLGE-E0-EXECUTION-ENGINE-PENDING",
        "SLGE-P0-LIFECYCLE-PROJECTION-PENDING",
        "SLGE-G0-ENFORCEMENT-PENDING",
        "SLGE-C0-CLOSURE-AUDIT-PENDING"
      ],
      "trace_refs": [